{
  "schema_version": "1.0",
  "bridge_id": "BR-SCHED-TQ-001",
  "boundary_id": "scheduler_dispatch__to__task_queue_pop_ready",
  "callee_requirement": "TaskQueue.C003",
  "available_contract_facts": [
    { "obligation_id": "Scheduler.C010", "role": "caller-precondition" }
  ],
  "target_expression": "TaskQueue.pop_ready(args, callee_state)",
  "protocol_class": "pairwise",
  "bridge_logic": {
    "bindings": { "caller_self": "Scheduler" },
    "premises": ["caller_self.ready()"],
    "conclusion": { "obligation_id": "TaskQueue.C003" }
  },
  "review": {
    "reviewer": "alice",
    "reviewed_at": "2026-08-30"
  }
}
